{"actor_id":"fixture-reviewer","created_at":"2026-09-08T00:00:00Z","evidence_refs":["fixture-evidence"],"proposal":{"path":"framing/disposition.json","sha256":"0000000000000000000000000000000000000000000000000000000000000000"},"question_id":null,"rationale":"Structural fixture only; real role provenance is required at runtime.","review_id":"fixture-disposition-review","reviewed_actor_id":"fixture-author","schema_version":"2.0","verdict":"LIMITED"}
